Mcdowell Acme Cars of Chandler;459 Lakeview Drive;Chandler;AZ;37134;
Morales Acme Cars of Chandler;194 Front Street;Chandler;AZ;26596;
Parks Acme Cars of Chandler;544 James Street;Chandler;AZ;53640;
Lyons Acme Cars of Laredo;788 Water Street;Laredo;TX;33122;
Shields Acme Cars of Laredo;285 Lakeview Drive;Laredo;TX;92871;
Reese Acme Cars of Laredo;506 Shady Lane;Laredo;TX;29934;
Bird Acme Cars of Saskatoon;316 Berkshire Drive;Saskatoon;SK;4M8U5;
Ellison Acme Cars of Saskatoon;203 6th Street North;Saskatoon;SK;4K6F7;
Franklin Acme Cars of Saskatoon;212 Lake Street;Saskatoon;SK;8E4G7;
Hogan Acme Cars of Norfolk;264 Fairway Drive;Norfolk;VA;95982;
Meyer Acme Cars of Norfolk;271 Spruce Street;Norfolk;VA;67553;
Cruz Acme Cars of Norfolk;305 Mill Street;Norfolk;VA;96368;
Wise Acme Cars of Durham;728 6th Street West;Durham;NC;82343;
Burke Acme Cars of Durham;314 Hamilton Street;Durham;NC;76978;
Aguirre Acme Cars of Durham;867 Grove Street;Durham;NC;28897;
Howard Acme Cars of Madison;666 East Street;Madison;WI;28203;
Ryan Acme Cars of Madison;137 Valley Road;Madison;WI;60855;
Howell Acme Cars of Madison;214 East Street;Madison;WI;99149;
Peters Acme Cars of Longueuil;107 Mulberry Street;Longueuil;PQ;8P4H2;
Huff Acme Cars of Longueuil;856 Locust Street;Longueuil;PQ;6W2V3;
Figueroa Acme Cars of Longueuil;868 Church Road;Longueuil;PQ;1Q8N2;
Mills Acme Cars of Lubbock;816 Warren Street;Lubbock;TX;74552;
Cantu Acme Cars of Lubbock;571 New Street;Lubbock;TX;64219;
Hubbard Acme Cars of Lubbock;157 Berkshire Drive;Lubbock;TX;31231;
Rose Acme Cars of Irvine;221 Meadow Lane;Irvine;CA;57513;
Yates Acme Cars of Irvine;793 Beech Street;Irvine;CA;25646;
Lutz Acme Cars of Irvine;387 Cambridge Court;Irvine;CA;56848;
Mcneil Acme Cars of Winston-Salem;365 Berkshire Drive;Winston-Salem;NC;91737;
Lloyd Acme Cars of Winston-Salem;414 Wood Street;Winston-Salem;NC;79090;
Guerra Acme Cars of Winston-Salem;385 Laurel Street;Winston-Salem;NC;65797;
Mullen Acme Cars of Glendale;178 6th Street West;Glendale;AZ;79669;
Pennington Acme Cars of Glendale;361 Cedar Street;Glendale;AZ;25639;
Estrada Acme Cars of Glendale;551 7th Avenue;Glendale;AZ;99869;
Hebert Acme Cars of Garland;219 Pennsylvania Avenue;Garland;TX;11014;
Cruz Acme Cars of Garland;748 Jefferson Avenue;Garland;TX;77206;
Morrison Acme Cars of Garland;181 Spruce Street;Garland;TX;48820;
Hammond Acme Cars of Hialeah;168 7th Avenue;Hialeah;FL;49743;
Hahn Acme Cars of Hialeah;893 5th Street;Hialeah;FL;18010;
Webster Acme Cars of Hialeah;863 3rd Avenue;Hialeah;FL;49036;
Lutz Acme Cars of Reno;495 Wood Street;Reno;NV;37179;
Mcgrath Acme Cars of Reno;335 Washington Avenue;Reno;NV;10603;
Cuevas Acme Cars of Reno;564 Pearl Street;Reno;NV;27966;
Schroeder Acme Cars of Kitchener;609 4th Street West;Kitchener;ON;0A5X3;
Kelley Acme Cars of Kitchener;464 Laurel Lane;Kitchener;ON;1E7U8;
Perry Acme Cars of Kitchener;140 12th Street;Kitchener;ON;7L6L1;
Stuart Acme Cars of Burnaby;221 5th Avenue;Burnaby;BC;4A0F0;
Bradford Acme Cars of Burnaby;621 Mulberry Street;Burnaby;BC;0S7B3;
Martin Acme Cars of Burnaby;961 Elizabeth Street;Burnaby;BC;7O2D6;
Gordon Acme Cars of Chesapeake;341 Pearl Street;Chesapeake;VA;81203;
Escobar Acme Cars of Chesapeake;749 Harrison Street;Chesapeake;VA;24628;
Shelton Acme Cars of Chesapeake;185 Academy Street;Chesapeake;VA;64415;
Hubbard Acme Cars of Gilbert;448 6th Street;Gilbert;AZ;45274;
House Acme Cars of Gilbert;115 Pleasant Street;Gilbert;AZ;35811;
Figueroa Acme Cars of Gilbert;310 2nd Street East;Gilbert;AZ;87420;
Griffith Acme Cars of Baton Rouge;380 New Street;Baton Rouge;LA;12632;
Peters Acme Cars of Baton Rouge;649 Lake Street;Baton Rouge;LA;62771;
Flowers Acme Cars of Baton Rouge;271 11th Street;Baton Rouge;LA;74309;
Rocha Acme Cars of Irving;836 Charles Street;Irving;TX;51327;
Chang Acme Cars of Irving;235 12th Street;Irving;TX;42836;
Reed Acme Cars of Irving;950 River Street;Irving;TX;22226;
Becker Acme Cars of Scottsdale;511 Brookside Drive;Scottsdale;AZ;33132;
Gardner Acme Cars of Scottsdale;543 Holly Drive;Scottsdale;AZ;58330;
Bender Acme Cars of Scottsdale;498 Virginia Avenue;Scottsdale;AZ;62909;
Good Acme Cars of Fremont;479 5th Street West;Fremont;CA;35835;
Pollard Acme Cars of Fremont;391 2nd Street West;Fremont;CA;15721;
Duke Acme Cars of Fremont;618 Primrose Lane;Fremont;CA;99286;
Lin Acme Cars of Windsor;219 Woodland Drive;Windsor;ON;7Q7B7;
Owens Acme Cars of Windsor;970 Mill Street;Windsor;ON;1D3H3;
Singh Acme Cars of Windsor;682 Laurel Lane;Windsor;ON;3Y2D4;
Wyatt Acme Cars of Regina;650 Lafayette Avenue;Regina;SK;2D7W3;
Woodard Acme Cars of Regina;766 10th Street;Regina;SK;6R5W1;
Gordon Acme Cars of Regina;882 Woodland Drive;Regina;SK;1S2E3;
Downs Acme Cars of Boise City;265 Belmont Avenue;Boise City;ID;62452;
Atkinson Acme Cars of Boise City;998 Highland Avenue;Boise City;ID;35549;
House Acme Cars of Boise City;870 Primrose Lane;Boise City;ID;80127;
Estes Acme Cars of Richmond;775 Cedar Lane;Richmond;VA;85211;
Fitzgerald Acme Cars of Richmond;266 Lake Street;Richmond;VA;69255;
Mcgrath Acme Cars of Richmond;737 Prospect Avenue;Richmond;VA;31511;
Potts Acme Cars of San Bernardino;168 Hill Street;San Bernardino;CA;49386;
Hale Acme Cars of San Bernardino;761 Surrey Lane;San Bernardino;CA;77385;
Oneal Acme Cars of San Bernardino;141 1st Street;San Bernardino;CA;31596;
Oliver Acme Cars of Birmingham;427 Dogwood Drive;Birmingham;AL;83678;
Juarez Acme Cars of Birmingham;386 River Street;Birmingham;AL;14266;
Reese Acme Cars of Birmingham;945 Market Street;Birmingham;AL;57373;
Riley Acme Cars of Spokane;886 Main Street West;Spokane;WA;23047;
Becker Acme Cars of Spokane;807 Liberty Street;Spokane;WA;72421;
Contreras Acme Cars of Spokane;839 James Street;Spokane;WA;61603;
Bowman Acme Cars of Rochester;929 6th Street West;Rochester;NY;50483;
Walker Acme Cars of Rochester;170 River Road;Rochester;NY;13965;
Potter Acme Cars of Rochester;223 3rd Avenue;Rochester;NY;96522;
Delgado Acme Cars of Des Moines;272 Academy Street;Des Moines;IA;23921;
Delgado Acme Cars of Des Moines;508 New Street;Des Moines;IA;68136;
Leon Acme Cars of Des Moines;669 Sunset Drive;Des Moines;IA;39454;
Bray Acme Cars of Modesto;717 4th Avenue;Modesto;CA;27730;
Horton Acme Cars of Modesto;147 3rd Street West;Modesto;CA;77803;
Knapp Acme Cars of Modesto;750 Summit Street;Modesto;CA;91508;
Lucas Acme Cars of Fayetteville;200 Linden Street;Fayetteville;NC;70865;
Barajas Acme Cars of Fayetteville;790 Belmont Avenue;Fayetteville;NC;36270;
Stanton Acme Cars of Fayetteville;935 Clark Street;Fayetteville;NC;72541;
Gibson Acme Cars of Tacoma;530 Division Street;Tacoma;WA;57340;
